{
  "schema_version": "evidence-object-1",
  "evidence_uuid": "22222222-2222-4222-8222-222222222222",
  "case_uuid": "11111111-1111-4111-8111-111111111111",
  "source_designation": "forensic_copy",
  "evidence_class": "fsnap_package",
  "byte_length": 10,
  "validation_state": "ComputedUnanchored"
}
